{
  "$schema": "https://json-schema.org/draft/2020-12/schema",
  "$id": "domain-entities-schema.json",
  "title": "Domain Entities Schema",
  "description": "Schema for domain-entities.json — machine-readable companion to CHARTER.md capturing bounded context, entities, relationships, scope boundaries, and drift signals",
  "type": "object",
  "required": [
    "boundedContext",
    "entities",
    "scopeBoundaries",
    "driftSignals"
  ],
  "properties": {
    "$schema": {
      "type": "string"
    },
    "generatedFrom": {
      "type": "string",
      "description": "Source file this was derived from (typically CHARTER.md)"
    },
    "generatedAt": {
      "type": "string",
      "description": "ISO date when this file was last generated or updated"
    },
    "projectVersion": {
      "type": "string",
      "description": "Project version at time of generation"
    },
    "warning": {
      "type": "string",
      "description": "Optional non-fatal warning surfaced by the generator (e.g. missing Key Entities section — see #2379)"
    },
    "boundedContext": {
      "type": "object",
      "required": [
        "name",
        "purpose",
        "boundary"
      ],
      "properties": {
        "name": {
          "type": "string",
          "description": "Name of the bounded context (typically project name)"
        },
        "purpose": {
          "type": "string",
          "description": "Brief statement of what this project does"
        },
        "boundary": {
          "type": "string",
          "description": "What distinguishes in-scope from out-of-scope work"
        }
      },
      "additionalProperties": false
    },
    "entities": {
      "type": "object",
      "description": "Entity definitions keyed by entity identifier (kebab-case)",
      "additionalProperties": {
        "type": "object",
        "required": [
          "description"
        ],
        "properties": {
          "description": {
            "type": "string",
            "description": "What this entity represents in the domain"
          },
          "external": {
            "type": "boolean",
            "description": "True if this entity is managed in an external repository"
          },
          "count": {
            "type": "integer",
            "description": "Current known count of instances"
          },
          "countSource": {
            "type": "object",
            "description": "How to verify the count programmatically",
            "properties": {
              "glob": {
                "type": "string",
                "description": "Glob pattern to count matching files/directories"
              },
              "command": {
                "type": "string",
                "description": "Shell command that outputs the count"
              },
              "exclude": {
                "type": "array",
                "items": {
                  "type": "string"
                },
                "description": "Patterns to exclude from count"
              }
            },
            "additionalProperties": false
          },
          "instances": {
            "type": "array",
            "items": {
              "type": "string"
            },
            "description": "Named instances when count is small and stable"
          },
          "subtypes": {
            "type": "array",
            "items": {
              "type": "string"
            },
            "description": "Classification subtypes for multi-tier entities"
          },
          "locations": {
            "type": "array",
            "items": {
              "type": "string"
            },
            "description": "File paths or directories where instances live"
          },
          "managedIn": {
            "type": "string",
            "description": "External repository that owns this entity's source"
          },
          "managedBy": {
            "type": "string",
            "description": "Tool or application that manages this entity"
          },
          "repo": {
            "type": "string",
            "pattern": "^[A-Za-z0-9._-]+/[A-Za-z0-9._-]+$",
            "description": "Companion repository identity as owner/name. The key a gh --repo invocation needs; locations holds only a bare display name."
          },
          "board": {
            "type": "string",
            "pattern": "^[A-Za-z0-9._-]+/[0-9]+$",
            "description": "Companion project board as owner/number, when the companion has one."
          },
          "searchable": {
            "type": "boolean",
            "description": "This companion may be swept for prior art and cross-referenced. Separate from fileIssues: searchable-but-not-filable is the common case."
          },
          "fileIssues": {
            "type": "boolean",
            "description": "Issues may be filed against this companion from this project."
          },
          "relationships": {
            "type": "array",
            "items": {
              "type": "object",
              "required": [
                "type",
                "target"
              ],
              "properties": {
                "type": {
                  "type": "string",
                  "description": "Relationship type (e.g., has-many, belongs-to, consumed-by, delegates-to)"
                },
                "target": {
                  "type": "string",
                  "description": "Target entity key (must exist as a key in entities)"
                },
                "repository": {
                  "type": "string",
                  "description": "Target repository if relationship crosses project boundaries"
                },
                "evidence": {
                  "type": "string",
                  "description": "Source text or reasoning that supports this relationship"
                }
              },
              "additionalProperties": false
            },
            "description": "Typed relationships to other entities"
          },
          "lastVerified": {
            "type": "string",
            "description": "ISO date when this entity's count was last verified against the filesystem"
          },
          "validationOverride": {
            "type": "object",
            "description": "Explicit min/max range override for count validation",
            "properties": {
              "min": {
                "type": "integer",
                "description": "Minimum expected count"
              },
              "max": {
                "type": "integer",
                "description": "Maximum expected count"
              }
            },
            "required": [
              "min",
              "max"
            ],
            "additionalProperties": false
          },
          "addedInVersion": {
            "type": "string",
            "description": "Version when this entity was added to the model"
          }
        },
        "additionalProperties": false
      }
    },
    "problemStatement": {
      "type": "string",
      "description": "Problem statement from charter, describing the core problem the project addresses"
    },
    "techStack": {
      "type": "array",
      "items": {
        "type": "object",
        "required": [
          "layer",
          "technology"
        ],
        "properties": {
          "layer": {
            "type": "string",
            "description": "Architecture layer (e.g., Content, Scripts, CI/CD, Testing)"
          },
          "technology": {
            "type": "string",
            "description": "Technology used at this layer"
          }
        },
        "additionalProperties": false
      },
      "description": "Technology stack from charter Tech Stack table"
    },
    "architecture": {
      "type": "object",
      "properties": {
        "subsections": {
          "type": "array",
          "items": {
            "type": "object",
            "required": [
              "heading"
            ],
            "properties": {
              "heading": {
                "type": "string",
                "description": "Subsection heading"
              },
              "description": {
                "type": "string",
                "description": "Brief summary of subsection content"
              },
              "diagram": {
                "type": "string",
                "description": "ASCII diagram from code block, if present"
              }
            },
            "additionalProperties": false
          },
          "description": "### headings under ## Architecture with optional diagrams"
        },
        "tables": {
          "type": "array",
          "items": {
            "type": "object",
            "required": [
              "parentHeading",
              "columns",
              "rows"
            ],
            "properties": {
              "parentHeading": {
                "type": "string",
                "description": "Subsection heading this table appeared under"
              },
              "columns": {
                "type": "array",
                "items": {
                  "type": "string"
                },
                "description": "Column headers"
              },
              "rows": {
                "type": "array",
                "items": {
                  "type": "object"
                },
                "description": "Table rows as objects keyed by column name"
              }
            },
            "additionalProperties": false
          },
          "description": "Markdown tables extracted into column/row objects"
        },
        "components": {
          "type": "array",
          "items": {
            "type": "object",
            "required": [
              "name"
            ],
            "properties": {
              "name": {
                "type": "string",
                "description": "Component name"
              },
              "role": {
                "type": "string",
                "description": "Component role"
              },
              "inferredFrom": {
                "type": "string",
                "description": "Source subsection"
              }
            },
            "additionalProperties": false
          },
          "description": "Named components inferred from architecture content"
        }
      },
      "additionalProperties": false,
      "description": "Structured architecture from charter Architecture section"
    },
    "currentFocus": {
      "type": "array",
      "items": {
        "type": "string"
      },
      "description": "Current focus areas from charter, used for scope alignment checks"
    },
    "scopeBoundaries": {
      "type": "object",
      "required": [
        "inScope",
        "outOfScope"
      ],
      "properties": {
        "inScope": {
          "type": "array",
          "items": {
            "type": "string"
          },
          "description": "What is in scope for this project"
        },
        "outOfScope": {
          "type": "array",
          "items": {
            "type": "string"
          },
          "description": "What is explicitly out of scope"
        }
      },
      "additionalProperties": false
    },
    "driftSignals": {
      "type": "object",
      "required": [
        "entityOutOfBounds",
        "scopeExpansion"
      ],
      "properties": {
        "entityOutOfBounds": {
          "type": "array",
          "items": {
            "type": "object",
            "required": [
              "signal",
              "severity"
            ],
            "properties": {
              "signal": {
                "type": "string",
                "description": "Description of the drift signal"
              },
              "severity": {
                "type": "string",
                "enum": [
                  "error",
                  "warning"
                ],
                "description": "Severity: error for out-of-bounds, warning for scope expansion"
              }
            },
            "additionalProperties": false
          },
          "description": "Signals indicating work has crossed project boundaries"
        },
        "scopeExpansion": {
          "type": "array",
          "items": {
            "type": "object",
            "required": [
              "signal",
              "severity"
            ],
            "properties": {
              "signal": {
                "type": "string",
                "description": "Description of the scope expansion signal"
              },
              "severity": {
                "type": "string",
                "enum": [
                  "error",
                  "warning"
                ],
                "description": "Severity: typically warning for scope expansion"
              }
            },
            "additionalProperties": false
          },
          "description": "Signals indicating scope is expanding beyond charter boundaries"
        }
      },
      "additionalProperties": false
    },
    "validationRules": {
      "type": "array",
      "items": {
        "type": "object",
        "required": [
          "type",
          "description"
        ],
        "properties": {
          "type": {
            "type": "string",
            "enum": [
              "count-range",
              "location-exists",
              "relationship-target-valid"
            ],
            "description": "Type of runtime validation check"
          },
          "entity": {
            "type": "string",
            "description": "Entity key this rule applies to"
          },
          "description": {
            "type": "string",
            "description": "Human-readable description of what this rule checks"
          },
          "min": {
            "type": "integer",
            "description": "Minimum expected count (for count-range rules)"
          },
          "max": {
            "type": "integer",
            "description": "Maximum expected count (for count-range rules)"
          },
          "lastVerified": {
            "type": "string",
            "description": "ISO date when count was last verified (propagated from entity)"
          }
        },
        "additionalProperties": false
      },
      "description": "Runtime validation checks for entity integrity"
    }
  },
  "additionalProperties": false
}
